{
  "schema_version": 1,
  "case_id": "BT-002",
  "slice": "business-doc-review",
  "objective": "审查 feature-B 的需求与技术文档集，找出互相矛盾的需求表述：同一约束在同一份文档内前后说成两个值，或在不同文档复述时取值不一致；同时报告行话未就地说明的问题。每条问题给出所在文档、一句话结论和可复核的原文引文。",
  "input_ref": "evals/business/inputs/BT-002.md",
  "acceptance_criteria": [
    "每条 finding 的 path 指向五份目标文档之一，evidence 是该文档的逐字引文。",
    "报告矛盾时能指出互相冲突的两处表述，而不是只描述其中一处。",
    "同一处问题只报一条，不因它出现在多份文档里就重复报。"
  ],
  "protected_guardrails": [
    "read-only-target-snapshot",
    "evidence-must-quote-target-docs",
    "no-credentials-or-internal-urls-in-findings"
  ],
  "holdout": false,
  "repeat_count": 3,
  "tags": [
    "requirement-review",
    "intra-document-contradiction",
    "cross-document-value-mismatch",
    "terminology-ambiguity"
  ],
  "target_id": "aiwork-workflow-ai",
  "target_pin": "3b379b84d01d841ca7a37b8317e76a8c54dd8d09",
  "target_docs": [
    "docs/features/feature-B/proposal/proposal.md",
    "docs/features/feature-B/spec/be/spec-backend.md",
    "docs/features/feature-B/spec/fe/spec-frontend.md",
    "docs/features/feature-B/design/be/tech-design-backend.md",
    "docs/features/feature-B/plan/be/backend-plan.md"
  ],
  "seeds_ref": "evals/business/seeds/BT-002.seeds.json",
  "findings_contract": {
    "path_pattern": "findings/{case_id}/rep-{rep}/findings.json",
    "format": "json",
    "required_fields": [
      "path",
      "issue",
      "evidence"
    ]
  },
  "grading": {
    "min_seed_recall": 0.5
  }
}
