{
  "schema_version": 1,
  "case_id": "BT-001",
  "slice": "business-doc-review",
  "objective": "把 feature-A 的功能文档集当作一次常规评审来读：逐份读完快照里的四份文档，报告行话未就地说明、同一约束在不同文档复述时取值不一致、以及表格单元格不能单独读懂这三类问题；每条问题给出所在文档、一句话结论和可复核的原文引文。",
  "input_ref": "evals/business/inputs/BT-001.md",
  "acceptance_criteria": [
    "每条 finding 的 path 指向四份目标文档之一，evidence 是该文档的逐字引文。",
    "报告的问题都能在文档里指到出处；没有出处的推测不算。",
    "同一处问题只报一条，不因它出现在多份文档里就重复报。"
  ],
  "protected_guardrails": [
    "read-only-target-snapshot",
    "evidence-must-quote-target-docs",
    "no-credentials-or-internal-urls-in-findings"
  ],
  "holdout": false,
  "repeat_count": 3,
  "tags": [
    "seed-defect-review",
    "terminology-ambiguity",
    "cross-document-consistency",
    "table-self-containment"
  ],
  "target_id": "aiwork-workflow-ai",
  "target_pin": "3b379b84d01d841ca7a37b8317e76a8c54dd8d09",
  "target_docs": [
    "docs/features/feature-A/spec/be/spec-backend.md",
    "docs/features/feature-A/spec/qa/spec-acceptance.md",
    "docs/features/feature-A/design/be/tech-design-backend.md",
    "docs/features/feature-A/plan/be/backend-plan.md"
  ],
  "seeds_ref": "evals/business/seeds/BT-001.seeds.json",
  "findings_contract": {
    "path_pattern": "findings/{case_id}/rep-{rep}/findings.json",
    "format": "json",
    "required_fields": [
      "path",
      "issue",
      "evidence"
    ]
  },
  "grading": {
    "min_seed_recall": 0.5
  }
}
