{
  "schema_version": 1,
  "case_id": "BT-003",
  "slice": "business-doc-review",
  "objective": "对 feature-C 的文档集做跨文档一致性核查：把同一约束（上限、超时、间隔、配置键取值）在各份文档里的复述逐条比对，报告取值互相不一致的载体；同时报告行话未就地说明的问题。每条问题给出所在文档、一句话结论和可复核的原文引文。",
  "input_ref": "evals/business/inputs/BT-003.md",
  "acceptance_criteria": [
    "每条 finding 的 path 指向三份目标文档之一，evidence 是该文档的逐字引文。",
    "报告不一致时给出发生冲突的具体取值，并说明它与哪一份文档的取值冲突。",
    "同一处问题只报一条，并按缺陷所在的那份文档填写 path。"
  ],
  "protected_guardrails": [
    "read-only-target-snapshot",
    "evidence-must-quote-target-docs",
    "no-credentials-or-internal-urls-in-findings"
  ],
  "holdout": false,
  "repeat_count": 3,
  "tags": [
    "cross-document-consistency",
    "carrier-sweep",
    "cross-document-value-mismatch",
    "terminology-ambiguity"
  ],
  "target_id": "aiwork-workflow-ai",
  "target_pin": "3b379b84d01d841ca7a37b8317e76a8c54dd8d09",
  "target_docs": [
    "docs/features/feature-C/design/be/tech-design-backend.md",
    "docs/features/feature-C/spec/qa/spec-acceptance.md",
    "docs/features/feature-C/plan/be/backend-plan.md"
  ],
  "seeds_ref": "evals/business/seeds/BT-003.seeds.json",
  "findings_contract": {
    "path_pattern": "findings/{case_id}/rep-{rep}/findings.json",
    "format": "json",
    "required_fields": [
      "path",
      "issue",
      "evidence"
    ]
  },
  "grading": {
    "min_seed_recall": 0.5
  }
}
